{
  "id": "cloud-mfa-disabled-root-v1",
  "name": "Cloud: Root Account MFA Disabled",
  "description": "Triggered when root MFA is disabled. Re-enables MFA and pages the cloud-platform owner immediately.",
  "version": "1.0.0",
  "tags": [
    "cloud-misconfig",
    "cloud",
    "iam",
    "mfa",
    "mitre.t1556"
  ],
  "trigger": {
    "on": "alert",
    "severity": [
      "critical"
    ],
    "tags": [
      "cloud-misconfig"
    ]
  },
  "author": "Quarry",
  "enabled": true,
  "created_at": "2026-05-03T00:00:00+00:00",
  "updated_at": "2026-05-03T00:00:00+00:00",
  "steps": [
    {
      "id": "reenable-mfa",
      "name": "Re-enable root MFA",
      "type": "http",
      "params": {
        "url": "${AWS_URL}/iam/root/mfa/enable",
        "method": "POST"
      },
      "on_failure": "continue",
      "retry_max": 0,
      "timeout_seconds": 20
    },
    {
      "id": "inv",
      "name": "Identify actor and intent",
      "type": "investigate",
      "params": {
        "case_id_field": "alert.case_id",
        "focus": "cloud"
      },
      "on_failure": "continue",
      "retry_max": 0,
      "timeout_seconds": 180
    },
    {
      "id": "n1",
      "name": "Page platform-owner",
      "type": "notify",
      "params": {
        "channel": "pagerduty",
        "message_template": "Root MFA was disabled \u2014 re-enabled. Investigate {{alert.actor}}.",
        "service_key_env": "PD_PLATFORM_KEY"
      },
      "on_failure": "continue",
      "retry_max": 0,
      "timeout_seconds": 10
    },
    {
      "id": "t1",
      "name": "Open root-MFA ticket",
      "type": "create_ticket",
      "params": {
        "priority": "P1",
        "title_template": "Root MFA disabled by {{alert.actor}}",
        "queue": "soc"
      },
      "on_failure": "continue",
      "retry_max": 0,
      "timeout_seconds": 20
    }
  ]
}
